{"scope_type":"ACCOUNT","scope_id":"acct-1","command_id":"kill-command-0002","command_fingerprint":"cccccccccccccccccccccccccccccccccccccccccccccccccccccccccccccccc","idempotency_key":"kill-idempotency-0002","enabled":true,"previous_enabled":false,"cancel_active_orders":true,"reason":"account control","reason_code":"RISK_BREACH","operator_id":"operator-2","changed_at":"2026-08-11T01:00:00Z","previous_version":3,"current_version":4,"authorization_id":"authorization-2","leader_lease_id":"leader-lease-2","fencing_token":"fencing-token-0002","effect_evidence":{"control_journal_position":11,"persisted_at":"2026-08-11T01:00:00Z"},"policy_version":"policy-v2","policy_checksum":"dddddddddddddddddddddddddddddddddddddddddddddddddddddddddddddddd","recovery_evidence_reference":null}
