{"scope_type":"GLOBAL","scope_id":null,"command_id":"kill-command-0001","command_fingerprint":"aaaaaaaaaaaaaaaaaaaaaaaaaaaaaaaaaaaaaaaaaaaaaaaaaaaaaaaaaaaaaaaa","idempotency_key":"kill-idempotency-0001","enabled":true,"previous_enabled":false,"cancel_active_orders":true,"reason":"emergency control","reason_code":"MANUAL_EMERGENCY","operator_id":"operator-1","changed_at":"2026-08-11T01:00:00Z","previous_version":2,"current_version":3,"authorization_id":"authorization-1","leader_lease_id":"leader-lease-1","fencing_token":"fencing-token-0001","effect_evidence":{"control_journal_position":10,"persisted_at":"2026-08-11T01:00:00Z"},"policy_version":"policy-v1","policy_checksum":"bbbbbbbbbbbbbbbbbbbbbbbbbbbbbbbbbbbbbbbbbbbbbbbbbbbbbbbbbbbbbbbb","recovery_evidence_reference":null}
