{"scope_type":"ACCOUNT","scope_id":"acct-1","command_id":"kill-command-0002","command_fingerprint":"cccccccccccccccccccccccccccccccccccccccccccccccccccccccccccccccc","idempotency_key":"kill-idempotency-0002","enabled":false,"previous_enabled":true,"cancel_active_orders":false,"reason":"verified operator release","reason_code":"OPERATOR_RELEASE","operator_id":"operator-2","approval_id":"approval-2","changed_at":"2026-08-11T01:00:00.123456Z","previous_version":3,"current_version":4,"authorization_id":"authorization-2","leader_lease_id":"leader-lease-2","fencing_token":"fencing-token-0002","effect_evidence":{"control_journal_position":11,"persisted_at":"2026-08-11T01:00:00.123456Z"},"policy_version":"policy-v2","policy_checksum":"dddddddddddddddddddddddddddddddddddddddddddddddddddddddddddddddd","recovery_evidence_reference":"recovery-barrier-2"}
