{"scope_type":"GLOBAL","scope_id":null,"command_id":"kill-command-0003","command_fingerprint":"eeeeeeeeeeeeeeeeeeeeeeeeeeeeeeeeeeeeeeeeeeeeeeeeeeeeeeeeeeeeeeee","idempotency_key":"kill-idempotency-0003","enabled":false,"previous_enabled":true,"cancel_active_orders":false,"reason":"verified operator release","reason_code":"OPERATOR_RELEASE","operator_id":"operator-3","approval_id":"approval-3","changed_at":"2026-08-11T01:00:00Z","previous_version":4,"current_version":5,"authorization_id":"authorization-3","leader_lease_id":"leader-lease-3","fencing_token":"fencing-token-0003","effect_evidence":{"control_journal_position":12,"persisted_at":"2026-08-11T01:00:00Z"},"policy_version":"policy-v3","policy_checksum":"ffffffffffffffffffffffffffffffffffffffffffffffffffffffffffffffff","recovery_evidence_reference":"recovery-barrier-3"}
